{
  "kind": "setup",
  "schema_version": 1,
  "id": "core.setup.balanced",
  "name": "Balanced setup",
  "description": "Original five-control handling model, with explicitly bounded user adjustments.",
  "model": "five-control-v1",
  "controls": {
    "wing": {
      "minimum": 1,
      "maximum": 9,
      "default": 5,
      "label": "Wing level",
      "description": "More cornering support; less straight-line speed."
    },
    "balance": {
      "minimum": -3,
      "maximum": 3,
      "default": 0,
      "label": "Aero balance",
      "description": "Forward balance helps turn-in; rearward balance supports traction."
    },
    "suspension": {
      "minimum": 1,
      "maximum": 9,
      "default": 5,
      "label": "Suspension",
      "description": "Firm supports dry corners; soft tolerates wet and uneven loading."
    },
    "cooling": {
      "minimum": 1,
      "maximum": 9,
      "default": 5,
      "label": "Cooling aperture",
      "description": "More airflow reduces engine heat at a drag cost."
    },
    "bias": {
      "minimum": 52,
      "maximum": 62,
      "default": 56,
      "label": "Front brake bias %",
      "description": "Moves braking load between axles. Adjustable during the race."
    }
  },
  "effects": {
    "wing_centre": 5.0,
    "suspension_centre": 5.0,
    "cooling_centre": 5.0,
    "bias_centre": 56.0,
    "balance_gain": 0.016,
    "wheel_balance_gain": 0.34,
    "braking_balance_gain": 0.004,
    "wing_corner_gain": 0.012,
    "suspension_corner_gain": 0.003,
    "wet_suspension_factor": 2.0,
    "corner_balance_loss": 0.12,
    "corner_min": 0.88,
    "corner_max": 1.12,
    "wing_drag_loss": 0.007,
    "cooling_drag_loss": 0.002,
    "wheel_bias_gain": 12.0,
    "wheel_bias_limit": 2.0,
    "bias_brake_loss": 0.01,
    "brake_min": 0.9,
    "suspension_traction_gain": 0.008,
    "balance_traction_loss": 0.25,
    "traction_min": 0.91,
    "traction_max": 1.02
  },
  "baselines": {
    "balanced": {
      "wing": 5,
      "balance": 0,
      "suspension": 5,
      "cooling": 5,
      "bias": 56
    },
    "low_drag": {
      "wing": 2,
      "balance": 0,
      "suspension": 5,
      "cooling": 4,
      "bias": 56
    },
    "stable_wet": {
      "wing": 7,
      "balance": 0,
      "suspension": 3,
      "cooling": 6,
      "bias": 56
    }
  },
  "initial_temperatures": {
    "engine_c": 85.0,
    "brake_c": 140.0
  }
}
